Nome scuola,Indirizzo,Grado,Forma,Sito,Telefono,Mail,Aiuto disabilità,Linguistico,Classico,Scientifico,Scienze Applicate,Scienze Umane,Economico Sociale,Artistico,Telecomunicazioni,Automazione,Informatica,ITI 4 Anni,Turistico,Web Community,Finanza e Marketing,Relazioni per il Marketing,Sistemi Aziendali,Turistico Sportivo
Micronido Oasi del sorriso,Via Cesare Battisti n. 3A,Asilo nido,Privata,https://www.oasidelsorriso-vigasio.it/ ,045 7364228,mara.zaffani@hotmail.it,sì,,,,,,,,,,,,,,,,,
Asilo nido Il piccolo puzzle,Via San Martino n. 14,Asilo nido,Privata,https://www.facebook.com/IlPiccoloPuzzle/?locale=it_IT ,045 668 5769,ilpiccolopuzzle@csa-coop.it,non specificato,,,,,,,,,,,,,,,,,
Fondazione Don Gedeone Massaggia,Via Asilo n.7,Infanzia,Privata,https://www.donmassaggia.it/ ,045-736-3115,info@donmassaggia.it,non specificato,,,,,,,,,,,,,,,,,
Scuola Materna Maria Ausiliatrice,Via San Martino n. 16,Infanzia,Privata,https://www.infanziavillatora.it/ ,049 640131,scuolamaterna.villatora@gmail.com,non specificato,,,,,,,,,,,,,,,,,
Scuola Materna di Isolalta,Via Villafranca n. 76,Infanzia,Privata,http://www.scuolainfanziaisolalta.it/la-scuola/ ,045 6699133,maternaisolalta@tiscali.it,non specificato,,,,,,,,,,,,,,,,,
Scuola materna statale Arcobaleno,Viale Bassini n. 1,Infanzia,Pubblica,https://www.icvigasio.edu.it/ ,0457363136,VRIC89600T@istruzione.it,sì,,,,,,,,,,,,,,,,,
Scuola primaria Italo Montemezzi,Viale Bassini n. 4,Primaria,Pubblica,https://www.icvigasio.edu.it/ ,0457363136,VRIC89600T@istruzione.it,sì,,,,,,,,,,,,,,,,,
Scuola secondaria di primo grado di Vigasio,Viale Bassini n. 6,Secondaria I Grado,Pubblica,https://www.icvigasio.edu.it/ ,0457363136,VRIC89600T@istruzione.it,sì,,,,,,,,,,,,,,,,,
